{
  "Ibn al-Jawzi": {
    "name_arabic": "ابن الجوزي",
    "name_latin": "Ibn al-Jawzi",
    "shamela_author_id": "51",
    "death_date_hijri": "٥٩٧",
    "birth_date_hijri": "٥٠٨",
    "death_date_gregorian": "١٢٠١",
    "birth_date_gregorian": "١١١٤",
    "biography": "ابن الجَوْزي (٥٠٨ - ٥٩٧ هـ = ١١١٤ - ١٢٠١ م)\nعبد الرحمن بن علي بن محمد الجوزي القرشي البغدادي، أبو الفرج\n• علامة عصره في التاريخ والحديث\n• كثير التصانيف\n• مولده ووفاته ببغداد، ونسبته إلى (مشرعة الجوز) من محالها.له نحو ثلاث مئة مصنف، منها:\n• (تلقيح فهوم أهل الآثار، في مختصرالسير والأخبار-ط) قطعة منه\n• (الأذكياء وأخبارهم - ط)\n• (مناقب عمر بن عبد العزيز - ط)\n• (روح الأرواح - ط)\n• (شذور العقود في تاريخ العهود - خ)\n• (المدهش - ط) في المواعظ وغرائب الأخبارو (المقيم المقعد - خ) في دقائق العربية\n• (صولة العقل على الهوى - خ) في الأخلاق\n• (الناسخ والمنسوخ - خ) حديث\n• (تلبيس إبليس - ط)\n• (فنون الأفنان في عيون علوم القرآن - ط)\n• (لقط المنافع - خ) في الطب والفراسة عند العرب\n• (المنتظم في تاريخ الملوك والأمم - ط) ستة أجزاء منه، واختصره فسماه (مختصر المنتظم - خ)\n• (الذهب المسبوك في سير الملوك - خ)\n• (عجائب البدائع - خ)\n• (الحمقى والمغفلين - ط)\n• (الوفا في فضائل المصطفى - ط) في جزأين\n• (مناقب عمر بن الخطاب - ط)\n• (مناقب أحمد بن حنبل - ط)\n• (صيد الخاطر - ط) آراء وسوانح\n• (الياقوتة - ط) وعظ\n• (المختار من أخبار المختار - خ)\n• (مثير عزم الساكن إلى أشرف الأماكن - خ) في تاريخ مكة والمدينة [طُبع]\n• (المجتبى من المجتنى - خ) جزء في أنواع العلوم [طُبع]\n• (مناقب بغداد - ط) رسالة\n• (الضعفاء والمتروكين - خ) في رجال الحديث [طُبع]\n• (المنظوم والمنثور في مجالس الصدور - خ) في خزانة الرباط (٩٠ أوقاف) وهو ٧٧ مجلسا، أوله الحمد للَّه حمد الشاكرين، بخط مغربي.و (المنهل العذب - أو الموارد العذاب - خ) في الوعظ، بخط الجراعي نسخة جيدة في الرباط (١٢٢ أوقاف) ونسخة أخرى في الرباط (٢٣ كتاني)\n• (غريب الحديث - خ) ستة أجزاء في مجلد متقن مصون، بخطه سنة ٥٨١ في الرباط (١٤٠ أوقاف) [طُبع]\n• (تبصرة المبتدي وتذكرة المنتهى) ويقال له (التبصرة - خ) الأول والثاني والثالث منه، في خزانة الرباط (٣٠٧ أوقاف) [طُبع]\n• (ريّ الظماء فيمن قال شعرا من الإماء - خ) عند حماد بو عياد، بفاس\n• (بحر الدموع - خ) في الوعظ، في الرباط (٢٥٢٢ كتاني) [طُبع]\n• (المنعش - خ) اقتنيته، في جزء لطيف\n• (المصفى باكفّ أهل الرسوخ في الناسخ والمنسوخ - خ) في القرآن. منه نسخة في الظاهرية بدمشق [طُبع]\n• (نزهة الأعين النواظر في علم الوجوه والنظائر - خ) تفسير [طُبع]\n• (الحدائق لأهل الحقائق - خ) ثلاث مجلدات، مواعظ\n• (المنتخب في النوب - خ)\n• (المقامات - خ)\n• (أسماء الضعفاء والواضعين - خ) في رجال الحديث\n• (فضائل القدس - خ)\n• (تبصرة الأخيار - خ) في نيل مصر وأنهارها\n• (تقويم اللسان - ط)\n• (جامع المسانيد والألقاب - خ) خمس مجلدات\n• (الموضوعات في الأحاديث المرفوعات - خ) الثالث منه وهو الأخير، في الرباط (٣٣ ق) كتب سنة ٦٠٠ [طُبع]\n• (زاد المسير في علم التفسير - ط)\n• (نتيجة الإحياء - خ) اختصر به إحياء علوم الدين\n• (شرح مشكل الصحيحين - خ) [طُبع]\n• (دفع شبهة التشبيه والرد على المجسمة - ط)\n• (التحقيق - خ) في أحاديث الخلاف. [طُبع]\n• ورأيت في خزانة الرباط (٥٨٩ د) مخطوطة مشرقية جيدة من كتاب (المرافق الموافق من كلام عبد الرحمن بن على الجوزي - خ) كتبت سنة ٧٣٣ (١).\n\n_________\n(١) وفيات الأعيان ١: ٢٧٩ والبداية والنهاية ١٣: ٢٨ ومفتاح السعادة ١: ٢٠٧ وذيل الروضتين ٢١ وفيه: (الجوزي نسبة إلى فرضة من فرض البصرة يقال لها جوزة، وفرضة النهر ثلمته التي يستقى منها) نسب إليها جده السابع جعفر بن عبد الله. وابن الوردي ٢: ١١٨ وآداب اللغة ٣: ٩١ والتبيان - خ. وفيه: (وقد امتحن، فحبس بواسط، ثم أطلق بعد خمس سنين). والفهرس التمهيدي.وفي نموذج الشيخ منير ٧٨ أن كتاب (أخبار النساء) المطبوع بمصر سنة ١٣١٩ منسوبا إلى ابن قيم الجوزية، هو لابن الجوزي. ودائرة المعارف الإسلامية ١: ١٢٥ والبعثة المصرية ٢٠ وانفرد سبطه ابن قز أو غلي، في مرآة الزمان ٨: ٤٨١ بتسميته (عبد الرحمن بن محمد بن علي بن عبد الله)\n\nنقلا عن: «الأعلام» للزركلي [مع إضافات بين معقوفين]",
    "biography_source": null,
    "books_count": 1,
    "books": [
      {
        "id": "22",
        "title": "كتاب أعمار الأعيان"
      }
    ]
  }
}